{
  "schema_version": "2.0.0",
  "id": "kenshi",
  "display_name": "Kenshi",
  "game": {
    "publisher": "Lo-Fi Games",
    "release_year": 2018,
    "genres": [
      "Sandbox role-playing",
      "Squad strategy",
      "Survival",
      "Single-player"
    ],
    "official_url": "https://lofigames.com/kenshi/"
  },
  "detection": {
    "processes": [
      {
        "executable": "kenshi_x64.exe",
        "required": true,
        "window_title_regex": "(?i)^Kenshi$"
      },
      {
        "executable": "kenshi_x86.exe",
        "required": true,
        "window_title_regex": "(?i)^Kenshi$"
      }
    ],
    "stores": [
      {
        "store": "steam",
        "app_id": "233860",
        "install_directory_hints": [
          "Kenshi"
        ]
      },
      {
        "store": "gog",
        "install_directory_hints": [
          "Kenshi"
        ]
      },
      {
        "store": "standalone",
        "install_directory_hints": [
          "Kenshi"
        ]
      }
    ],
    "builds": [
      {
        "build_id": "1.0.*",
        "status": "experimental",
        "reason": "External capture and explicit selection are available; modded dialogue and world states require conservative fallbacks."
      },
      {
        "build_id": "unknown",
        "status": "experimental",
        "reason": "Unknown and heavily modded builds remain declarative external-capture-only with manual character selection."
      }
    ],
    "capture": {
      "preferred_methods": [
        "windows_graphics_capture",
        "desktop_duplication",
        "audio_subtitles"
      ],
      "excluded_window_title_regexes": [
        "(?i)forgotten construction set",
        "(?i)kenshi launcher",
        "(?i)mod.*tool"
      ],
      "allow_exclusive_fullscreen": false,
      "fallback": "audio_subtitles",
      "ui_regions": [
        {
          "id": "management-hud",
          "purpose": "exclude_identity",
          "rect": {
            "x": 0,
            "y": 0.72,
            "width": 1,
            "height": 0.28
          }
        },
        {
          "id": "squad-panel",
          "purpose": "exclude_compositing",
          "rect": {
            "x": 0,
            "y": 0.78,
            "width": 0.62,
            "height": 0.22
          }
        },
        {
          "id": "dialogue-panel",
          "purpose": "dialogue_indicator",
          "rect": {
            "x": 0.12,
            "y": 0.48,
            "width": 0.76,
            "height": 0.46
          }
        },
        {
          "id": "world-nameplate-area",
          "purpose": "nameplate_hint",
          "rect": {
            "x": 0.08,
            "y": 0.08,
            "width": 0.84,
            "height": 0.62
          }
        }
      ]
    }
  },
  "safety": {
    "single_player_only": true,
    "online_policy": "blocked",
    "anti_cheat_policy": "block_when_detected",
    "declarative_only": true,
    "risk_notes": [
      "Kenshi is single-player, but its highly mutable world and extensive Workshop ecosystem make static assumptions unsafe; save state always outranks profile lore.",
      "The Forgotten Construction Set and third-party mods are never controlled or executed by this declarative profile.",
      "Unnamed recruits and procedurally changing residents use encounter- or save-scoped IDs so similar models never share memories."
    ]
  },
  "capabilities": {
    "conversation": {
      "tier": "replay_verified",
      "evidence": [
        {
          "kind": "deterministic_replay",
          "reference": "profile-replay-v1:kenshi:conversation",
          "summary": "The versioned offline profile replay completes a bounded deterministic conversation turn."
        }
      ],
      "fallback": "Offer typed input and a retryable LLM error without changing providers automatically."
    },
    "identity": {
      "tier": "experimental",
      "evidence": [
        {
          "kind": "deterministic_replay",
          "reference": "profile-replay-v1:kenshi:identity",
          "summary": "The versioned replay selects the declared character explicitly and exercises the offscreen explicit-name fallback."
        }
      ],
      "fallback": "Require explicit character-name selection; offscreen or obscured NPCs continue through audio and subtitles."
    },
    "capture": {
      "tier": "unsupported",
      "evidence": [
        {
          "kind": "declarative_contract",
          "reference": "game-profile-v2:kenshi:capture-fallback",
          "summary": "The profile declares only allowlisted Windows capture methods and an audio/subtitle fallback; no live capture is claimed."
        }
      ],
      "fallback": "Continue in audio-and-subtitles mode without capturing or modifying the game image."
    },
    "subtitles": {
      "tier": "replay_verified",
      "evidence": [
        {
          "kind": "deterministic_replay",
          "reference": "profile-replay-v1:kenshi:subtitles",
          "summary": "The versioned offline profile replay emits the delivered sentence text used by the subtitle route."
        }
      ],
      "fallback": "Keep delivered dialogue in the Conversation view and surface a retry if subtitle presentation fails."
    },
    "memory": {
      "tier": "replay_verified",
      "evidence": [
        {
          "kind": "deterministic_replay",
          "reference": "profile-replay-v1:kenshi:memory",
          "summary": "The versioned offline profile replay commits only delivered dialogue and retrieves scoped turn memory."
        }
      ],
      "fallback": "Continue with recent turn context and profile lore without vector retrieval; never fabricate recalled facts."
    },
    "screen_space_lip_sync": {
      "tier": "experimental",
      "evidence": [
        {
          "kind": "not_verified",
          "reference": "game-profile-v2:kenshi:screen-space-lip-sync:unverified",
          "summary": "Generic screen-space mouth compositing has no live-game verification for this profile."
        }
      ],
      "fallback": "Restore the untouched game image within one displayed frame and continue with audio and subtitles."
    }
  },
  "content": {
    "character_data_readiness": "curated",
    "character_data_readiness_notes": "Shipped named-character records have stable IDs and authored biography, personality, dialogue-style, prompt, voice-intent, explicit-selection identity, and provenance metadata; live visual identity is not certified.",
    "world_lore": "Kenshi takes place on a harsh moon where no central authority guarantees safety, truth, food, medicine, or freedom. Deserts, acid lands, ruined industrial sites, fertile valleys, and fortified cities support societies with incompatible laws and beliefs. The United Cities binds wealth, slavery, and noble power; the Holy Nation enforces an exclusionary religious order; the Shek Kingdom prizes strength while wrestling with survival; anti-slavers, rebels, traders, hivers, skeletons, raiders, and isolated communities pursue their own futures. History survives in fragments, propaganda, machines, ruins, and people who have reasons to lie. The player's squad has no prescribed identity: recruits, losses, alliances, bases, crimes, bounties, injuries, and faction relations must be supplied by save state. Dialogue should sound local and materially grounded—food, wounds, weather, patrols, work, taxes, slavery, trade, and survival—rather than delivering omniscient lore lectures.",
    "spoiler_policy": "Expose common faction beliefs and regional dangers by default. Gate ancient-history interpretations, faction leaders' private aims, special recruits, and world-state changes behind explicit discovery tiers.",
    "spoiler_tiers": [
      {
        "id": "wanderer-knowledge",
        "description": "Common geography, visible factions, survival needs, trade, bounties, and public laws.",
        "default_enabled": true
      },
      {
        "id": "faction-leadership",
        "description": "Leaders, capitals, faction strategies, diplomatic tensions, and protected institutions.",
        "default_enabled": false
      },
      {
        "id": "ancient-history",
        "description": "Skeleton testimony, lost empires, ruins, and competing interpretations of the world's past.",
        "default_enabled": false
      },
      {
        "id": "world-state",
        "description": "Consequences of imprisoned or killed leaders, destroyed settlements, and modded overrides.",
        "default_enabled": false
      }
    ],
    "background_npc_rules": [
      "Create a unique save-scoped ID for every unnamed drifter, guard, trader, slave, farmer, tech hunter, hiver, skeleton, raider, or recruit.",
      "Use explicit faction uniform, settlement ownership, dialogue label, and supplied reputation as evidence; appearance alone cannot establish allegiance or intent.",
      "Give a person knowledge of their route, work, faction rules, and witnessed events, not hidden global state or ancient history.",
      "Never normalize slavery, religious persecution, starvation, or racial hierarchy as objective truth; characters may hold setting-appropriate beliefs that the narration does not endorse.",
      "Incapacitation, enslavement, imprisonment, faction change, and death must come from current save evidence and immediately update the encounter state.",
      "Mod-added races, factions, towns, and characters remain unknown until a user-provided declarative extension supplies provenance and identifiers."
    ],
    "provenance": [
      {
        "id": "profile-original",
        "title": "Interactive NPCs Kenshi profile prose",
        "kind": "original",
        "license": "MIT",
        "notes": "All lore summaries, biographies, personality notes, and prompts are original project prose with no copied wiki, dialogue, audio, or game assets."
      },
      {
        "id": "kenshi-official",
        "title": "Kenshi official site",
        "kind": "official",